{
  "version": "1.0",
  "description": "Docker configuration settings for VDE VMs",
  "base_settings": {
    "context": "../../..",
    "base_dockerfile": "configs/docker/vde-base.Dockerfile",
    "network": "vde-net",
    "username": "devuser",
    "uid": 1000,
    "gid": 1000,
    "public_keys_dir": "/public-ssh-keys"
  },
  "languages": {
    "c": {
      "compose_file": "configs/docker/languages/c/docker-compose.yml",
      "env_file": "env-files/vde-c.env",
      "image": "vde-c:latest",
      "container_name": "vde-c",
      "workspace_mount": "projects/c:/home/devuser/workspace",
      "logs_mount": "logs/c:/logs"
    },
    "cpp": {
      "compose_file": "configs/docker/languages/cpp/docker-compose.yml",
      "env_file": "env-files/vde-cpp.env",
      "image": "vde-cpp:latest",
      "container_name": "vde-cpp",
      "workspace_mount": "projects/cpp:/home/devuser/workspace",
      "logs_mount": "logs/cpp:/logs"
    },
    "asm": {
      "compose_file": "configs/docker/languages/asm/docker-compose.yml",
      "env_file": "env-files/vde-asm.env",
      "image": "vde-asm:latest",
      "container_name": "vde-asm",
      "workspace_mount": "projects/asm:/home/devuser/workspace",
      "logs_mount": "logs/asm:/logs"
    },
    "python": {
      "compose_file": "configs/docker/languages/python/docker-compose.yml",
      "env_file": "env-files/vde-python.env",
      "image": "vde-python:latest",
      "container_name": "vde-python",
      "workspace_mount": "projects/python:/home/devuser/workspace",
      "logs_mount": "logs/python:/logs"
    },
    "rust": {
      "compose_file": "configs/docker/languages/rust/docker-compose.yml",
      "env_file": "env-files/vde-rust.env",
      "image": "vde-rust:latest",
      "container_name": "vde-rust",
      "workspace_mount": "projects/rust:/home/devuser/workspace",
      "logs_mount": "logs/rust:/logs"
    },
    "js": {
      "compose_file": "configs/docker/languages/js/docker-compose.yml",
      "env_file": "env-files/vde-js.env",
      "image": "vde-js:latest",
      "container_name": "vde-js",
      "workspace_mount": "projects/js:/home/devuser/workspace",
      "logs_mount": "logs/js:/logs"
    },
    "csharp": {
      "compose_file": "configs/docker/languages/csharp/docker-compose.yml",
      "env_file": "env-files/vde-csharp.env",
      "image": "vde-csharp:latest",
      "container_name": "vde-csharp",
      "workspace_mount": "projects/csharp:/home/devuser/workspace",
      "logs_mount": "logs/csharp:/logs"
    },
    "ruby": {
      "compose_file": "configs/docker/languages/ruby/docker-compose.yml",
      "env_file": "env-files/vde-ruby.env",
      "image": "vde-ruby:latest",
      "container_name": "vde-ruby",
      "workspace_mount": "projects/ruby:/home/devuser/workspace",
      "logs_mount": "logs/ruby:/logs"
    },
    "go": {
      "compose_file": "configs/docker/languages/go/docker-compose.yml",
      "env_file": "env-files/vde-go.env",
      "image": "vde-go:latest",
      "container_name": "vde-go",
      "workspace_mount": "projects/go:/home/devuser/workspace",
      "logs_mount": "logs/go:/logs"
    },
    "java": {
      "compose_file": "configs/docker/languages/java/docker-compose.yml",
      "env_file": "env-files/vde-java.env",
      "image": "vde-java:latest",
      "container_name": "vde-java",
      "workspace_mount": "projects/java:/home/devuser/workspace",
      "logs_mount": "logs/java:/logs"
    },
    "kotlin": {
      "compose_file": "configs/docker/languages/kotlin/docker-compose.yml",
      "env_file": "env-files/vde-kotlin.env",
      "image": "vde-kotlin:latest",
      "container_name": "vde-kotlin",
      "workspace_mount": "projects/kotlin:/home/devuser/workspace",
      "logs_mount": "logs/kotlin:/logs"
    },
    "swift": {
      "compose_file": "configs/docker/languages/swift/docker-compose.yml",
      "env_file": "env-files/vde-swift.env",
      "image": "vde-swift:latest",
      "container_name": "vde-swift",
      "workspace_mount": "projects/swift:/home/devuser/workspace",
      "logs_mount": "logs/swift:/logs"
    },
    "php": {
      "compose_file": "configs/docker/languages/php/docker-compose.yml",
      "env_file": "env-files/vde-php.env",
      "image": "vde-php:latest",
      "container_name": "vde-php",
      "workspace_mount": "projects/php:/home/devuser/workspace",
      "logs_mount": "logs/php:/logs"
    },
    "scala": {
      "compose_file": "configs/docker/languages/scala/docker-compose.yml",
      "env_file": "env-files/vde-scala.env",
      "image": "vde-scala:latest",
      "container_name": "vde-scala",
      "workspace_mount": "projects/scala:/home/devuser/workspace",
      "logs_mount": "logs/scala:/logs"
    },
    "r": {
      "compose_file": "configs/docker/languages/r/docker-compose.yml",
      "env_file": "env-files/vde-r.env",
      "image": "vde-r:latest",
      "container_name": "vde-r",
      "workspace_mount": "projects/r:/home/devuser/workspace",
      "logs_mount": "logs/r:/logs"
    },
    "lua": {
      "compose_file": "configs/docker/languages/lua/docker-compose.yml",
      "env_file": "env-files/vde-lua.env",
      "image": "vde-lua:latest",
      "container_name": "vde-lua",
      "workspace_mount": "projects/lua:/home/devuser/workspace",
      "logs_mount": "logs/lua:/logs"
    },
    "flutter": {
      "compose_file": "configs/docker/languages/flutter/docker-compose.yml",
      "env_file": "env-files/vde-flutter.env",
      "image": "vde-flutter:latest",
      "container_name": "vde-flutter",
      "workspace_mount": "projects/flutter:/home/devuser/workspace",
      "logs_mount": "logs/flutter:/logs"
    },
    "elixir": {
      "compose_file": "configs/docker/languages/elixir/docker-compose.yml",
      "env_file": "env-files/vde-elixir.env",
      "image": "vde-elixir:latest",
      "container_name": "vde-elixir",
      "workspace_mount": "projects/elixir:/home/devuser/workspace",
      "logs_mount": "logs/elixir:/logs"
    },
    "haskell": {
      "compose_file": "configs/docker/languages/haskell/docker-compose.yml",
      "env_file": "env-files/vde-haskell.env",
      "image": "vde-haskell:latest",
      "container_name": "vde-haskell",
      "workspace_mount": "projects/haskell:/home/devuser/workspace",
      "logs_mount": "logs/haskell:/logs"
    }
  },
  "services": {
    "postgres": {
      "compose_file": "configs/docker/services/postgres/docker-compose.yml",
      "env_file": "env-files/vde-postgres.env",
      "image": "vde-postgres:latest",
      "container_name": "vde-postgres",
      "data_mount": "data/postgres:/data",
      "logs_mount": "logs/postgres:/logs"
    },
    "redis": {
      "compose_file": "configs/docker/services/redis/docker-compose.yml",
      "env_file": "env-files/vde-redis.env",
      "image": "vde-redis:latest",
      "container_name": "vde-redis",
      "data_mount": "data/redis:/data",
      "logs_mount": "logs/redis:/logs"
    },
    "mongodb": {
      "compose_file": "configs/docker/services/mongodb/docker-compose.yml",
      "env_file": "env-files/vde-mongodb.env",
      "image": "vde-mongodb:latest",
      "container_name": "vde-mongodb",
      "data_mount": "data/mongodb:/data",
      "logs_mount": "logs/mongodb:/logs"
    },
    "nginx": {
      "compose_file": "configs/docker/services/nginx/docker-compose.yml",
      "env_file": "env-files/vde-nginx.env",
      "image": "vde-nginx:latest",
      "container_name": "vde-nginx",
      "data_mount": "data/nginx:/data",
      "logs_mount": "logs/nginx:/logs"
    },
    "couchdb": {
      "compose_file": "configs/docker/services/couchdb/docker-compose.yml",
      "env_file": "env-files/vde-couchdb.env",
      "image": "vde-couchdb:latest",
      "container_name": "vde-couchdb",
      "data_mount": "data/couchdb:/data",
      "logs_mount": "logs/couchdb:/logs"
    },
    "mysql": {
      "compose_file": "configs/docker/services/mysql/docker-compose.yml",
      "env_file": "env-files/vde-mysql.env",
      "image": "vde-mysql:latest",
      "container_name": "vde-mysql",
      "data_mount": "data/mysql:/data",
      "logs_mount": "logs/mysql:/logs"
    },
    "rabbitmq": {
      "compose_file": "configs/docker/services/rabbitmq/docker-compose.yml",
      "env_file": "env-files/vde-rabbitmq.env",
      "image": "vde-rabbitmq:latest",
      "container_name": "vde-rabbitmq",
      "data_mount": "data/rabbitmq:/data",
      "logs_mount": "logs/rabbitmq:/logs"
    }
  }
}
